SKU,Name,Price,Description,Image URLs,Brand Name,Category
6789908112452,Giày vải bata ,98000,"<p>Chơi bóng đá trên cỏ nhân tạo có thể làm cho bạn khó khăn khi chạy và có thể không giữ thăng bằng. Đó là lý do tại sao khi các chuyên gia luôn luôn khuyến khích và khuyên bạn nên đi giày bóng đá khi bạn chơi bóng trên sân cỏ nhân tạo.</p><p>- Mẫu giày được thiết kế có bề ngang lớn nên rất phù hợp với bàn chân người Việt.</p><p>- Thân giày được làm từ da PU ôm chân và rất mềm mại, thoát khi nóng rất tốt không gây hôi chân tạo sự thoải mái và tự tin đối với người sử dụ</p><p>- Đế giày được làm từ nhựa tổng hợp và thiết kế với những khối đinh nhỏ rãi đều trên bề mặt đế, có vân tròn hỗ trợ xoay chuyển. Đế được khâu sẵn chắc chắn ở phần mũi giày và phần gót giày giúp cầu thủ có thể tự tin thi đấu.</p><p>- Lót giày nằm bên trong được làm từ mary mesh tạo cảm giác êm và vừa vặn khi mang giày. Lót đế được thiết kế định hình ôm sát bàn chân tạo độ chắn chắn khi di chuyển và có thể tháo ra vệ sinh một cách dễ dàng.</p><p>- Với ưu điểm giá cả thấp hơn đối với các sản phẩm giày bóng đá khác và độ bền cực lâu nên Prowin là một trong những mẫu giày ưa chuộng tại Việt Nam.</p><p>Chất liệu : làm từ da PU cao cấp và đế cao su siêu bền</p><p>- Phom giày được chỉnh sửa cho phù hợp với chân của người Việt tạo độ fitting cao hơn.</p><p>- Phong cách : thể thao mạnh mẽ</p><p>- Kiểu dáng : Ôm</p><p>- Mùa : 4 mùa</p><p> </p><p>Giá sản phẩm trên Tiki đã bao gồm thuế theo luật hiện hành. Bên cạnh đó, tuỳ vào loại sản phẩm, hình thức và địa chỉ giao hàng mà có thể phát sinh thêm chi phí khác như phí vận chuyển, phụ phí hàng cồng kềnh, thuế nhập khẩu (đối với đơn hàng giao từ nước ngoài có giá trị trên 1 triệu đồng).....</p>",https://salt.tikicdn.com/ts/product/b2/14/b0/19d10bea15545adb5ce1200dd45b8dd1.jpg,OEM,Giày đá banh nam
9163419275016,"Giày đá bóng trẻ em Mira Pro KID Xanh Dương chính hãng, giày đá banh cỏ nhân tạo đẹp - PK002",345000,"<p>Liêu các bậc phụ huynh có tự hỏi không biết chọn cho bé 1 đôi giày đá bóng như nào phù hợp với đôi chân mà giá cả lại hợp lý hay không? AKI SPORT xin giới thiệu đến anh/chị mẫu giày Mira Pro KID phiên bản mới nhất chính là 1 sự lựa chọn hoàn hảo.</p><p>AKI SPORT xin được điểm qua tính năng của đôi giày bóng đá này:</p><p>- Thương hiệu: Mira</p><p>- Xuất xứ: Việt Nam chính hãng.</p><p>- Size: từ 30 đến 37</p><p>- Bề mặt sản phẩm được làm bằng TPU cao cấp tạo độ bền chắc chắn, chống gãy, thuận tiện khi vệ sinh hoặc lau chùi giày.</p><p>- Phần vỏ bao bọc bên ngoài của sản phẩm làm từ da Microfiber có đặc tính khá bền bỉ, chịu được nhiệt, có khả năng kháng khuẩn tốt, dễ dàng vệ sinh và lau chùi sạch sẽ.</p><p>- Phía bên trong giày có lớp lót mềm mại, thoáng khí.</p><p>- Chất liệu nhẹ và bền rất ôm chân cho cảm giác bóng tốt hơn.</p><p>- Màu sắc trẻ trung, bắt mắt tạo cảm giác mới lạ cho người dùng.</p><p>AKI SPORT mách bạn mẹo nhỏ bảo quản giày:</p><p>- Tránh tiếp xúc với hoá chất dễ làm hư da giày.</p><p>- Khi phơi nhớ phơi chỗ thoáng mát tránh ánh nắng mặt trời trực tiếp.</p><p>AKI SPORT CAM KẾT</p><p>- Hình ảnh sản phẩm là ảnh thật do shop tự chụp.</p><p>- Hàng có sẵn, giao hàng ngay khi nhận được đơn.</p><p>- Hoàn tiền nếu sản phẩm không giống với mô tả.</p><p>- Chấp nhận đổi hàng khi size không vừa.</p><p>- Giao hàng trên toàn quốc, nhận hàng trả tiền.</p><p>QUY ĐỊNH BẢO HÀNH, ĐỔI TRẢ</p><p>- Hàng hoá vẫn còn mới, chưa qua sử dụng</p><p>- Hàng hoá bị lỗi hoặc hư hỏng do vận chuyển hoặc do nhà sản xuất</p><p>2. Trường hợp được chấp nhận:</p><p>- Hàng không đúng size như quý khách đặt hàng .</p><p>- Không đủ số lượng như trong đơn hàng.</p><p>- Quá 07 ngày kể từ khi Quý khách nhận hàng.</p><p>- Gửi lại hàng không đúng mẫu mã, không phải sản phẩm của AKI</p><p>- Không thích, không hợp, đặt nhầm mã, nhầm màu,</p><p>Giá sản phẩm trên Tiki đã bao gồm thuế theo luật hiện hành. Bên cạnh đó, tuỳ vào loại sản phẩm, hình thức và địa chỉ giao hàng mà có thể phát sinh thêm chi phí khác như phí vận chuyển, phụ phí hàng cồng kềnh, thuế nhập khẩu (đối với đơn hàng giao từ nước ngoài có giá trị trên 1 triệu đồng)</p><p>Giá sản phẩm trên Tiki đã bao gồm thuế theo luật hiện hành. Bên cạnh đó, tuỳ vào loại sản phẩm, hình thức và địa chỉ giao hàng mà có thể phát sinh thêm chi phí khác như phí vận chuyển, phụ phí hàng cồng kềnh, thuế nhập khẩu (đối với đơn hàng giao từ nước ngoài có giá trị trên 1 triệu đồng).....</p>","https://salt.tikicdn.com/ts/product/b9/af/47/a4c03af4e8268ba76c6110abd1d7781f.jpg,https://salt.tikicdn.com/ts/product/62/cb/4d/4773de9e84fa56df3189ec6920f4bfd2.jpg,https://salt.tikicdn.com/ts/product/73/8e/5a/320d88e1a4ad59e5241365c95b12a61b.jpg,https://salt.tikicdn.com/ts/product/28/03/69/909815f98b5493704bd1cbc760065bd8.jpg",Mira,Giày đá banh nam
2806518824627,Giày Bóng Đá Sân Cỏ Nhân Tạo Parabol F01- Giày Đá Banh Sân Phủi - Bảo Hành 1 Tháng,568000,"<p>---- Chú ý: Giày bóng đá tại Fshop được bảo hành mọi lỗi sản xuất trong vòng 1 tháng kể từ khi nhận hàng. Nếu có bất cứ vấn đề gì về hàng hóa, xin bạn hãy liên hệ ngay với shop qua kênh chat hoặc thông tin trên phiếu bảo hành để được hỗ trợ ngay lập tức.</p><p>+ Giày Parabol F01 được thiết kế với da vi sợi cao cấp<br>+ Đế giày đá bóng sân cỏ nhân tạo, sân bê tông bằng cao su bền, và rất bám sân<br>+ Lót giày đá banh định hình EVA êm, chống sốc<br>+ Giày đá bóng nam Parabol có nhiều form chân vừa, trường hợp chân bạn form bè, hãy chọn lớn hơn 1 size nhé.<br>+ Trọng lượng giày nhẹ, chỉ 250gr/chiếc<br>+ Chất liệu không thấm nước và dễ dàng vệ sinh<br>----------------------------------</p><p>+ Giày đá banh Parabol F01 là mẫu giày hướng người chơi tới lối đá kiểm soát bóng tốt hơn, có lối chơi kỹ thuật, xử lý bóng khéo. Phần mũi giày đá bóng được dập nổi với các mức độ vừa phải , tạo ma sát vừa đủ để xử lý bóng ngắn trong những phạm vi hẹp.<br>+ Thiết kế đế giày đá bóng nam F02 thiết kế có chiều cao vừa phải tạo ra khả năng bám đa hướng tăng độ ma sát với mặt sân giúp người chơi trụ vững là một trong những lợi thế trong những pha tranh chấp với đối thủ đòi hỏi sức mạnh toàn thân.<br>+ Gót giày đá bóng nam chắc chắn, được định hình chắc chắn và có móc kéo để dễ xỏ giày</p><p>#giày_đá_bóng #giày_bóng_đá #giày_đá_banh #giày_đá_bóng_cổ_cao</p><p>Giá sản phẩm trên Tiki đã bao gồm thuế theo luật hiện hành. Bên cạnh đó, tuỳ vào loại sản phẩm, hình thức và địa chỉ giao hàng mà có thể phát sinh thêm chi phí khác như phí vận chuyển, phụ phí hàng cồng kềnh, thuế nhập khẩu (đối với đơn hàng giao từ nước ngoài có giá trị trên 1 triệu đồng).....</p>","https://salt.tikicdn.com/ts/product/6a/10/75/4881e27b3c0c9b83d3c89da9a60ea0d1.jpg,https://salt.tikicdn.com/ts/product/b8/68/ec/bb13451e1d10d16d33181cbf8a72e09d.jpg,https://salt.tikicdn.com/ts/product/3a/be/e7/b0730d23a38027cd47abf5da6ef4c760.jpg,https://salt.tikicdn.com/ts/product/12/90/e8/f369b049ff9aac0944cad5c04272f030.jpg",OEM,Giày đá banh nam
6329085645314,"Giày đá banh,giày đá bóng sân cỏ nhân tạo đã khâu đế 3 sọc màu trắng ",164000,"<p><strong>THÔNG TIN SẢN PHẨM</strong></p><div><div class=""attrs-block""><ul><li><strong>Chất liệu:</strong> Simili, PU, Nhựa.</li><li><strong>Độ cao:</strong> &lt; 5 cm.</li><li><strong>Giới tính sử dụng:</strong> Nam &amp; nữ.</li></ul></div><div class=""details-block""><div><p>Giày đá bóng đế trong siêu hót</p><p>Đã khâu hết đế,nên ko lo bung tróc, anh em tha hồ tỏa sáng trên sân cỏ</p><p>Mẫu mã thì ko phải chê,đang rất hót</p><p>Chất liệu simili bóng, tuyệt đẹp</p><p>Có lớp lót thấm hút, khô thoáng khi vận động</p><p>Thiết kế đế giày, phom giày ma sát với sân cỏ nhân tạo,nên điều chỉnh bóng rất tốt</p></div></div></div><p><strong>HƯỚNG DẪN CHỌN SIZE</strong></p><p><img src=""https://salt.tikicdn.com/ts/tmp/39/70/f9/8d75766844e6736230c213ce93b672b3.jpg"" alt="""" width=""750"" height=""317""></p><p>Giá sản phẩm trên Tiki đã bao gồm thuế theo luật hiện hành. Bên cạnh đó, tuỳ vào loại sản phẩm, hình thức và địa chỉ giao hàng mà có thể phát sinh thêm chi phí khác như phí vận chuyển, phụ phí hàng cồng kềnh, thuế nhập khẩu (đối với đơn hàng giao từ nước ngoài có giá trị trên 1 triệu đồng).....</p><p>Sản phẩm này là tài sản cá nhân được bán bởi Nhà Bán Hàng Cá Nhân và không thuộc đối tượng phải chịu thuế GTGT. Do đó hoá đơn VAT không được cung cấp trong trường hợp này.</p>",https://salt.tikicdn.com/ts/product/eb/1e/ac/471e2f4077bb9f9b23156b7359fcae8d.jpg,OEM,Giày đá banh nam
3770823845306,Giày Ba Ta Học Sinh,79000,"<p>Giầy bóng chuyền Bình Minh (trắng kẻ sọc xanh) là loại giày làm bằng chất liệu vải có kiểu dáng thể thao,<br>bền, đẹp, nhẹ. Giúp học sinh chạy nhảy,việc di chuyển nhẹ nhàng, linh hoạt, dễ chịu hơn cho đôi chân, không tạo cảm giác khó chịu.</p><p>Đặc điểm:</p><p><img src=""https://salt.tikicdn.com/ts/tmp/d9/e8/ac/27735aec898fa6060b35e396bbf7e05c.jpg"" alt="""" width=""750"" height=""1000""><br>Nhà sản xuất : Bình Minh<br>Chất liệu: vải thô<br>Màu sắc: màu trắng kẻ sọc đỏ<br>Đế giày: cao su tổng hợp chống trơn trượt<br>Thân giầy làm từ lớp lót bông</p><p>Size: 30-44 nhiều lựa chọn.</p><p>Thích hợp chơi bóng chuyền,đá bóng,đi bộ,à có thể tham gia các hoạt động ngoài trời<br>Sản phẩm được sản xuất theo HTQLCL &amp; MT đạt tiêu chuẩn: ISO 9001:2000 - ISO 14001:2004.<br>Sản phẩm được công nhận là hàng Việt Nam chất lượng cao.</p><p>Giá sản phẩm trên Tiki đã bao gồm thuế theo luật hiện hành. Bên cạnh đó, tuỳ vào loại sản phẩm, hình thức và địa chỉ giao hàng mà có thể phát sinh thêm chi phí khác như phí vận chuyển, phụ phí hàng cồng kềnh, thuế nhập khẩu (đối với đơn hàng giao từ nước ngoài có giá trị trên 1 triệu đồng).....</p>","https://salt.tikicdn.com/ts/product/92/39/c6/b6bb3ee0b2e21fea3d9473e7d5bd5f07.jpg,https://salt.tikicdn.com/ts/product/81/27/ed/20cb08dbd28ee93f8e9e4c6f2e044cb8.jpg,https://salt.tikicdn.com/ts/product/66/21/63/5e4175354effb1ee70e8466e71f3e362.jpg",OEM,Thể Thao - Dã Ngoại
9152391393022,Giày Tennis Nam chuyên dụng Jogarbola JG-21006,780000,"<p>Thương hiệu JOGARBOLA (gọi tắt JG) là hãng thời trang thể thao nổi tiếng tại Nhật Bản. </p><p>Là đại Lý chính thước cấp 1 của cnhà phân phối, shop gửi tới quý khách mẫu giày Tennis mới nhất năm 2021 với các ưu điểu nổi bật như sau:</p><p>Dòng giày JOGARBOLA 21006 được đánh giá cao về mẫu mã, chất lượng sử dụng, đặc biệt là độ êm và độ vừa vặn.</p><p>Ở phiên bản này, JG21006 trang bị một hệ thống hỗ trợ phần giữa bàn chân và đệm gót giúp chân vững chãi và không bị lật ngay cả khi di chuyển đổi hướng bất ngờ. Gót chân cũng sẽ cảm thấy độ êm ái với miếng lót ôm lấy gan bàn chân.</p><p>Chất liệu da PU tổng hợp kết hợp lưới ở phần mặt trên của giầy tạo cảm giác thoáng mát, ở 2 bên cùng phần cổ chân được tăng cường lớp đệm.</p><p>Mũi giày có tác dụng bảo vệ ngón chân khi di chuyển miết mũi chân xuống mặt sân. Giày rất mềm nên có thể cảm thấy tự nhiên ngay trong lần xỏ giày ra sân đầu tiên.</p><p>Đế giầy được làm bằng chất liệu cao su cao cấp, thiết kết với các rãnh xương cá chống trơn trượt và đặc biệt là độ bám sân tốt.</p><p>Thích hợp cho mọi loại sân như sân thảm, sân đất nệ</p><p> </p><p>Giá sản phẩm trên Tiki đã bao gồm thuế theo luật hiện hành. Bên cạnh đó, tuỳ vào loại sản phẩm, hình thức và địa chỉ giao hàng mà có thể phát sinh thêm chi phí khác như phí vận chuyển, phụ phí hàng cồng kềnh, thuế nhập khẩu (đối với đơn hàng giao từ nước ngoài có giá trị trên 1 triệu đồng).....</p>","https://salt.tikicdn.com/ts/product/2d/e0/6e/453fa884356f43166cb5a3c415b97b9e.jpg,https://salt.tikicdn.com/ts/product/c2/e7/65/db17fe9c98168b45d1b56d97fc91e182.jpg,https://salt.tikicdn.com/ts/product/c8/de/75/54e74df1e8432dfe069d701ccb11ff77.jpg,https://salt.tikicdn.com/ts/product/d2/21/1b/506bd35d8e4e36ad99e13176aa2aaf3c.jpg",Jogarbola,Giày tennis nam
4086650931907,Giày thể thao nam thời trang(s),196000,"<html><head></head><body><ul><p>THÔNG TIN SẢN PHẨM</p><p>Giày Nam Sneaker Thể Thao - Giày chạy bộ, giày tập</p><p>Giày đẹp, nhẹ, bền. Có thể làm giày cặp, giày nhóm. Thích hợp đi chơi, chạy bộ, gym, đi học, đi là</p><p>Có thể kết hợp Đồ, jeans, sooc, Ngố vv…. Đều phù hợp</p><p>Màu: ghi</p><p>Kích thước ( Size ) : 39 -40 - 41 - 42 - 43</p><p>Chất liệu.Vải Thoáng Khí</p><p>Xin kính chào quý khách</p></ul></body></html><p>Giá sản phẩm trên Tiki đã bao gồm thuế theo luật hiện hành. Bên cạnh đó, tuỳ vào loại sản phẩm, hình thức và địa chỉ giao hàng mà có thể phát sinh thêm chi phí khác như phí vận chuyển, phụ phí hàng cồng kềnh, thuế nhập khẩu (đối với đơn hàng giao từ nước ngoài có giá trị trên 1 triệu đồng).....</p><p>Sản phẩm này là tài sản cá nhân được bán bởi Nhà Bán Hàng Cá Nhân và không thuộc đối tượng phải chịu thuế GTGT. Do đó hoá đơn VAT không được cung cấp trong trường hợp này.</p>","https://salt.tikicdn.com/ts/product/e1/6c/c5/01be337ced78c4ee308ef05b3d7024b2.jpg,https://salt.tikicdn.com/ts/product/f9/aa/a4/6b8399158eaead395a2704b8341e401b.jpg,https://salt.tikicdn.com/ts/product/18/1c/6e/ec7668c99711ea63cbefc7dec121099d.jpg,https://salt.tikicdn.com/ts/product/d3/8d/67/a79d445ff31599e46c8ebb274d7a2cdb.jpg,https://salt.tikicdn.com/ts/product/37/11/47/3074aa8d26cef2021896d2dd4452f764.jpg,https://salt.tikicdn.com/ts/product/c5/5f/f2/5953799e12d920b8a808c08851139e67.jpg",OEM,Thể Thao - Dã Ngoại
4251932334961,Giày Bata Vải Thể Thao Bình Minh,89900,"<p>Giầy bóng chuyền Bình Minh (trắng kẻ sọc xanh) là loại giày làm bằng chất liệu vải có kiểu dáng thể thao,<br>bền, đẹp, nhẹ. Giúp công việc di chuyển nhẹ nhàng, linh hoạt, dễ chịu hơn cho đôi chân, không tạo cảm giác khó chịu.</p><p>Đặc điểm:<br>Nhà sản xuất : Bình Minh<br>Chất liệu: vải thô<br>Màu sắc: màu trắng kẻ sọc đỏ<br>Đế giày: cao su tổng hợp chống trơn trượt<br>Thân giầy làm từ lớp lót bông<br>Thích hợp chơi bóng chuyền,đá bóng,đi bộ,à có thể tham gia các hoạt động ngoài trời<br>Sản phẩm được sản xuất theo HTQLCL &amp; MT đạt tiêu chuẩn: ISO 9001:2000 - ISO 14001:2004.<br>Sản phẩm được công nhận là hàng Việt Nam chất lượng cao.</p><p><strong>Hướng dẫn chọn size:</strong></p><table border=""1""><tbody><tr><td><strong>Size</strong></td><td><strong>Chiều dài chân (mm)</strong></td></tr><tr><td>35</td><td>221 - 226</td></tr><tr><td>36</td><td>227 - 233</td></tr><tr><td>37</td><td>234 - 240</td></tr><tr><td>38</td><td>241 - 248</td></tr><tr><td>39</td><td>249 - 255</td></tr><tr><td>40</td><td>256 - 260</td></tr><tr><td>41</td><td>261 - 268</td></tr><tr><td>42</td><td>269 - 275</td></tr><tr><td>43</td><td>276 - 280</td></tr></tbody></table><p> </p><p> </p><p>Giá sản phẩm trên Tiki đã bao gồm thuế theo luật hiện hành. Bên cạnh đó, tuỳ vào loại sản phẩm, hình thức và địa chỉ giao hàng mà có thể phát sinh thêm chi phí khác như phí vận chuyển, phụ phí hàng cồng kềnh, thuế nhập khẩu (đối với đơn hàng giao từ nước ngoài có giá trị trên 1 triệu đồng).....</p>","https://salt.tikicdn.com/ts/product/98/d2/4e/5390033d2f812db12abfdfd175339081.jpg,https://salt.tikicdn.com/ts/product/47/8b/25/0ab33e8e76e4e7d39bb79713e31157fe.jpg",Bình Minh,Giày thể thao nam khác
9508013400578," Giầy đá bóng phủi sân cỏ nhân tạo CT3, giày đá banh, đế su khâu full đế",149000,"<p style=""text-align:center""><span style=""color:red""><em><strong>Giầy đá bóng phủi sân cỏ nhân tạo CT3, giày đá banh, đế su khâu full đế</strong></em></span></p><p style=""text-align:center""><em><strong><img src=""https://salt.tikicdn.com/ts/tmp/5f/8b/40/2b689c8071804914555c4b6308d794c5.jpg"" alt="""" width=""750"" height=""750""></strong></em></p><p style=""text-align:center""><em><strong>Size: 39-40-41-42-43<br>Chất liệu da PU, chống thấm nước<br>Đế giầy cao TF giúp tăng khả năng bám trụ.<br>Họa tiết logo sắc nét<br>Full khâu đế , chắc chắn , bền bỉ<br>Chất liệu đế: Cao su lưu hóa</strong></em></p><p style=""text-align:center""><em><strong><img style=""float:left"" src=""https://salt.tikicdn.com/ts/tmp/0a/86/18/3af8a2a13d525086599859faeeff1972.jpg"" alt="""" width=""750"" height=""750""><img src=""https://salt.tikicdn.com/ts/tmp/dd/6a/60/33bd9fdd532c02ebd3e6db924aff9429.jpg"" alt="""" width=""640"" height=""640""></strong></em></p><p style=""text-align:center""><em><strong>GIẦY ĐÁ BÓNG PHỦI 3 SỌC CT3 có đế TF , vổ thấp , thích hợp đá bóng trên mặt sân cỏ nhân tạo Nhưng cũng có thể đá trên sân cỏ tự nhiên ko vấn đề, sản phẩm được giới đá bóng phủi săn lùng . Giá tiền lại rất hợp lý cho a e chuyên bóng đá phủi ! </strong></em></p><p style=""text-align:left""><em><strong>️ Form ôm chân, cho cảm giác sút bóng tốt</strong></em></p><p style=""text-align:left""><em><strong>️ Kiểu dáng đơn giản nhưng k kém phần sang chảnh</strong></em></p><p style=""text-align:left""><em><strong>️ Mẫu mã đa dạng</strong></em></p><p style=""text-align:left""><em><strong>️ Đế độ cứng vừa phải, nhiều đinh bất chấp thời tiến mưu gió vẫn bám sân</strong></em></p><p style=""text-align:left""><em><strong>️ Giày đã khâu full đế và keo dán cực chắc chắn k lo bong tróc</strong></em></p><p style=""text-align:left""><em><strong>️</strong></em><em><strong> Một đôi giày tốt + giá hợp lý cho dân phủi.</strong></em></p><p> </p><p> </p><p><img id=""https://salt.tikicdn.com/ts/tmp/d7/18/de/2ab320635843f9410a4e7fceb31cd4de.jpg"" title="""" src=""https://salt.tikicdn.com/ts/tmp/d7/18/de/2ab320635843f9410a4e7fceb31cd4de.jpg"" alt="""" width=""750"" height=""750""><img src=""https://salt.tikicdn.com/ts/tmp/a3/ea/d5/80f609227309d25d8d74952c2b390544.jpg"" alt="""" width=""720"" height=""720""></p><p style=""text-align:center"">lớp da mềm tạo cảm giác thoải mái cho đôi bàn chân, chống thấm nước chống bụi bẩn chỉ cần lau là sạch</p><p style=""text-align:center"">đế bên trong lót 1 lớp tạo cảm giác cực kỳ êm chân khi chạy. Đế bên dưới là cấu tạo 1 hệ thống đinh chống trượt mà sát cực tốt giúp cầu thủ ko bị ngã trên sân</p><p style=""text-align:center"">form ôm chân giúp bạn đi chuyển vừa nhanh vừa thoải mái tạo ra những pha bóng đẹp mắt</p><p style=""text-align:left""><img src=""https://salt.tikicdn.com/ts/tmp/79/96/56/fa110cef7016a6d13b2097fbe0fca55b.jpg"" alt="""" width=""720"" height=""720""><img src=""https://salt.tikicdn.com/ts/tmp/c2/87/cb/747f0fa8f16ca180a13db031774e2ce5.jpg"" alt="""" width=""640"" height=""640""></p><p> </p><p>Giá sản phẩm trên Tiki đã bao gồm thuế theo luật hiện hành. Bên cạnh đó, tuỳ vào loại sản phẩm, hình thức và địa chỉ giao hàng mà có thể phát sinh thêm chi phí khác như phí vận chuyển, phụ phí hàng cồng kềnh, thuế nhập khẩu (đối với đơn hàng giao từ nước ngoài có giá trị trên 1 triệu đồng).....</p><p>Sản phẩm này là tài sản cá nhân được bán bởi Nhà Bán Hàng Cá Nhân và không thuộc đối tượng phải chịu thuế GTGT. Do đó hoá đơn VAT không được cung cấp trong trường hợp này.</p>","https://salt.tikicdn.com/ts/product/70/e2/9e/7c23a2ec3c9370fc9e8704e013a1c9ce.jpg,https://salt.tikicdn.com/ts/product/0a/86/18/5bd50c11919951cf06df4b889da124a9.jpg,https://salt.tikicdn.com/ts/product/dd/6a/60/e3d39b3ed5ba0453fa4c8623ee60a767.jpg,https://salt.tikicdn.com/ts/product/a2/a7/2c/1f30f898b666b9e12e52f76bcf7a627f.jpg,https://salt.tikicdn.com/ts/product/6f/07/dc/069c0c47708f18ba9fc2e711de3d7495.jpg,https://salt.tikicdn.com/ts/product/79/96/56/be15d602ff1aabe9cfaa7fd94cefd9a5.jpg,https://salt.tikicdn.com/ts/product/a3/ea/d5/3c0ce0f91e33c150fa41a707dcdff7c3.jpg,https://salt.tikicdn.com/ts/product/6f/64/89/d1d37bbb847dabef3f5ffd3bfca5ea32.jpg,https://salt.tikicdn.com/ts/product/c2/87/cb/4c9343781c141ff3e6420f3e55e0adf8.jpg,https://salt.tikicdn.com/ts/product/d7/18/de/265ed5d59da1c73b9cfb916656583c8f.jpg",OEM,Giày đá banh nam
3214654909221,Giày Bóng Đá Bata Vải TL - Đen,89000,"<ul><li><strong>GIÀY BÓNG ĐÁ VẢI TL </strong>là một trong những mẫu giày đang được các cầu thủ ưa chuộng bởi fom chuẩn ôm chân, rất bám sân, bền đẹp và thoáng khí.</li><li>Đế làm bằng kếp bề bỉ lại được khâu full đế nên rất bền, đặc biệt phần đế chống trơn giúp cho bạn an toàn trên mọi địa hình.</li><li>Form gọn, chất mềm, kiểu dáng năng động, trẻ trung, thích hợp khi đi học, đi chơi, du lịch, dã ngoại, tập GYM, đặc biệt dành cho đá banh.</li></ul><p><strong>Hướng dẫn chọn size:</strong></p><table border=""1""><tbody><tr><td><strong>Size</strong></td><td><strong>Chiều dài chân (mm)</strong></td></tr><tr><td>35</td><td>221 - 226</td></tr><tr><td>36</td><td>227 - 233</td></tr><tr><td>37</td><td>234 - 240</td></tr><tr><td>38</td><td>241 - 248</td></tr><tr><td>39</td><td>249 - 255</td></tr><tr><td>40</td><td>256 - 260</td></tr><tr><td>41</td><td>261 - 268</td></tr><tr><td>42</td><td>269 - 275</td></tr><tr><td>43</td><td>276 - 280</td></tr></tbody></table><p>Giá sản phẩm trên Tiki đã bao gồm thuế theo luật hiện hành. Bên cạnh đó, tuỳ vào loại sản phẩm, hình thức và địa chỉ giao hàng mà có thể phát sinh thêm chi phí khác như phí vận chuyển, phụ phí hàng cồng kềnh, thuế nhập khẩu (đối với đơn hàng giao từ nước ngoài có giá trị trên 1 triệu đồng).....</p>","https://salt.tikicdn.com/ts/product/e2/d0/fa/d3ae7cfd9793b7e653023744d04f31b3.jpg,https://salt.tikicdn.com/ts/product/43/11/0a/ec5534cf20572a478ab8847e4b9d69f8.jpg",OEM,Giày đá banh nam
