SKU,Name,Price,Description,Image URLs,Brand Name,Category
1329803339146,"Giày Nam New 2022, Giày Da Nam Cao Cấp - Fullbox 2 màu",99000,"<p>Một đôi giày thể thao mạnh mẽ,cá tính</p><p>Tăng chiều cao tự nhiên từ 3-4cm , cực thoải mái<br>Chất da cao cấp bền đẹp, lên chân nhẹ nhàng, thoải mái. Giày dễ dàng kết hợp nhiều loại trang phục hàng ngày.</p><p>Đặc điểm nổi bật:</p><p>- Chất da cao cấp bền đẹp<br>- Đế cao su non siêu nhẹ, bền bỉ<br>- Lên chân nhẹ nhàng, êm ái</p><p>- Thanh toán khi nhận hàng</p><p>- Giao hàng nhanh, phí giao hàng rẻ<br>- Hỗ trợ phí vận chuyển lên tới tối đa 40K (cho đơn hàng từ 200K trở lên).</p><p>- Dẫn đầu về phong cách thời trang, đa dạng về mẫu mã, phù hợp cho mọi đối tượng khách hàng.</p><p>- Kiểu dáng và màu sắc lên hình chuẩn 100% so với thực tế.</p><p>- Giá cả cạnh tranh nhất. - Giao hàng nhanh, hỗ trợ nhiệt tình, luôn lắng nghe ý kiến khách hàng</p><p>#giaynam #giaythapco #giaysneaker #sneaker #sneakernam #giayulzzang #giaythethao #giaythethaonam #giaydalon #giayhot #hottrend #giàynam #giàythấpcổ #thấpcổnam #giàythấpcổnam #giày #giàyulzzang #dalộn #giaỳhot #giaygiare #giare #giàygiárẻ #giàyđộc #giaydoc #giaydalon #giàydalộn</p><p>Giá sản phẩm trên Tiki đã bao gồm thuế theo luật hiện hành. Bên cạnh đó, tuỳ vào loại sản phẩm, hình thức và địa chỉ giao hàng mà có thể phát sinh thêm chi phí khác như phí vận chuyển, phụ phí hàng cồng kềnh, thuế nhập khẩu (đối với đơn hàng giao từ nước ngoài có giá trị trên 1 triệu đồng).....</p><p>Sản phẩm này là tài sản cá nhân được bán bởi Nhà Bán Hàng Cá Nhân và không thuộc đối tượng phải chịu thuế GTGT. Do đó hoá đơn VAT không được cung cấp trong trường hợp này.</p>","https://salt.tikicdn.com/ts/product/4f/23/70/88596ad76cfc340be870d37944358716.jpg,https://salt.tikicdn.com/ts/product/c3/6b/56/6d23b405a18dfd90eee5be95feec8578.png,https://salt.tikicdn.com/ts/product/9b/64/93/fccc3af2422fecd4799b52896376d767.png,https://salt.tikicdn.com/ts/product/b5/81/98/193775c9fb654b9124ce25a277b350d8.png,https://salt.tikicdn.com/ts/product/68/9d/af/8ac11f47eecd31340b7b6bc3161254ad.png",OEM,Giày thể thao nam cổ thấp
7970730688461,Giày sneaker thời trang nam - GL10,105000,"<ul style=""box-sizing:border-box;margin-top:0;margin-bottom:10px;color:#333;font-family:Roboto,Helvetica,Arial,sans-serif;font-size:13px;text-align:justify""><li style=""box-sizing:border-box""><span style=""box-sizing:border-box"">Giày Lười Vải Nam</span> được thiết kế theo phong cách trẻ trung và năng động, phù hợp với mọi địa hình di chuyển.</li><li style=""box-sizing:border-box"">Chất liệu vải cao cấp, bền đẹp.</li><li style=""box-sizing:border-box"">Đế bằng cao su tạo cảm giác êm ái, thoải mái khi vận động.</li><li style=""box-sizing:border-box"">Thiết kế mũi giày tròn, có đế giày xẻ rãnh chống trơn trượt, mang lại sự an toàn cho người mang.</li><li style=""box-sizing:border-box"">Kiểu dáng đa phong cách cùng màu sắc đa dạng, cho bạn dễ phối cùng nhiều trang phục.</li><li style=""box-sizing:border-box"">Giày có thể kết hợp với quần kaki, quần jean tạo nên phong cách trẻ trung và năng động.</li></ul><p style=""box-sizing:border-box;margin:5px 0 12px;color:#242424;font-family:Roboto,Helvetica,Arial,sans-serif;font-size:13px;text-align:justify""><span style=""box-sizing:border-box"">Hướng dẫn chọn size:</span></p><p style=""box-sizing:border-box;margin:5px 0 12px;color:#242424;font-family:Roboto,Helvetica,Arial,sans-serif;font-size:13px;text-align:justify""><span style=""box-sizing:border-box""><img src=""https://vcdn.tikicdn.com/ts/tmp/dc/3d/ed/1f3d7fb028d3a342f3b3827278b5b192.jpg"" alt="""" width=""750"" height=""500""></span></p><p style=""box-sizing:border-box;margin:5px 0 12px;color:#242424;font-family:Roboto,Helvetica,Arial,sans-serif;font-size:13px;text-align:justify""><span style=""box-sizing:border-box""><img src=""https://vn-live.slatic.net/v2/resize/products/S-26832-d57c9ab29e45e3171864a300beff0b1c.jpg"" alt="""" width=""750"" height=""519""></span></p><p style=""box-sizing:border-box;margin:5px 0 12px;color:#242424;font-family:Roboto,Helvetica,Arial,sans-serif;font-size:13px;text-align:justify""><span style=""box-sizing:border-box""><img src=""https://vn-live.slatic.net/v2/resize/products/S-26832-d865f4963c9c18a7df75557d22d96454.jpg"" alt="""" width=""735"" height=""544""></span></p><p style=""box-sizing:border-box;margin:5px 0 12px;color:#242424;font-family:Roboto,Helvetica,Arial,sans-serif;font-size:13px;text-align:justify""><span style=""box-sizing:border-box""><img src=""https://vn-live.slatic.net/v2/resize/products/S-26832-027daf92151ba6089cb104bbc65276bb.jpg"" alt="""" width=""750"" height=""505""></span></p><p style=""box-sizing:border-box;margin:5px 0 12px;color:#242424;font-family:Roboto,Helvetica,Arial,sans-serif;font-size:13px;text-align:justify""><span style=""box-sizing:border-box""><img src=""https://vn-live.slatic.net/v2/resize/products/S-26832-485a06f799e93b64b0e2442bcd50a6d8.jpg"" alt="""" width=""738"" height=""546""></span></p><p style=""box-sizing:border-box;margin:5px 0 12px;color:#242424;font-family:Roboto,Helvetica,Arial,sans-serif;font-size:13px;text-align:justify""><span style=""box-sizing:border-box""><img src=""https://vn-live.slatic.net/v2/resize/products/S-26832-210acdb39dc94b72f8a8c59b4b64d829.jpg"" alt="""" width=""750"" height=""499""></span></p><p style=""box-sizing:border-box;margin:5px 0 12px;color:#242424;font-family:Roboto,Helvetica,Arial,sans-serif;font-size:13px;text-align:justify""><span style=""box-sizing:border-box""><img src=""https://vn-live.slatic.net/v2/resize/products/S-26832-b63e28db76ff680ac25c1979f38d69e9.jpg"" alt="""" width=""750"" height=""516""></span></p><p style=""box-sizing:border-box;margin:5px 0 12px;color:#242424;font-family:Roboto,Helvetica,Arial,sans-serif;font-size:13px;text-align:justify""><span style=""box-sizing:border-box""><img src=""https://vn-live.slatic.net/v2/resize/products/S-26832-1fc74fdb9decfdbc01b45f20e9d42e3c.jpg"" alt="""" width=""750"" height=""520""></span></p><p style=""box-sizing:border-box;margin:5px 0 12px;color:#242424;font-family:Roboto,Helvetica,Arial,sans-serif;font-size:13px;text-align:justify""><span style=""box-sizing:border-box""><img src=""https://vn-live.slatic.net/v2/resize/products/S-26832-7dd2afe4ec7fc287749f3971cbe44a33.jpg"" alt="""" width=""750"" height=""501""></span></p><p style=""box-sizing:border-box;margin:5px 0 12px;color:#242424;font-family:Roboto,Helvetica,Arial,sans-serif;font-size:13px;text-align:justify""><span style=""box-sizing:border-box""><img src=""https://vn-live.slatic.net/v2/resize/products/S-26832-2be8dc8aeb54b5e813dd19065b4dd307.jpg"" alt="""" width=""570"" height=""545""></span></p><p>Giá sản phẩm trên Tiki đã bao gồm thuế theo luật hiện hành. Bên cạnh đó, tuỳ vào loại sản phẩm, hình thức và địa chỉ giao hàng mà có thể phát sinh thêm chi phí khác như phí vận chuyển, phụ phí hàng cồng kềnh, thuế nhập khẩu (đối với đơn hàng giao từ nước ngoài có giá trị trên 1 triệu đồng).....</p>","https://salt.tikicdn.com/ts/product/f1/30/dc/e585cb5abdbf16ed96e9e2257f30feaa.jpg,https://salt.tikicdn.com/ts/product/4c/86/0a/dfe2630dce6f80c4f1c566fa081b31bf.jpg,https://salt.tikicdn.com/ts/product/1e/6f/8b/3c8d5ee1836a1283d010fe510a6c65ac.jpg,https://salt.tikicdn.com/ts/product/ed/01/27/9d671cf0e7214a59674471432b5f9834.jpg,https://salt.tikicdn.com/ts/product/fa/cb/9d/85c10e5140d8071bc3a03b4b9153e194.jpg,https://salt.tikicdn.com/ts/product/f2/6f/e5/ac5865cf9fa75a4d1479ca8348e181f7.jpg",OEM,Thời Trang
6714504397574,"Giày nam giày sneaker lưới thoáng khí chống hôi chân, fullsize, 3 màu - #K86",79000,"<html><head></head><body><ul><p>- KÍNH CHÀO A,C,E ĐÃ GHÉ THĂM SẢN PHẨM SHOP:</p><p>- Shop chuyên cung cấp giày Sneaker nam toàn nước với thiết kế mẫu mã đa dạng hợp thời trang hợp mốt chắc hẳn sẽ làm hài lòng các thượng khách kỹ tính nhất</p><p>- Không qua trung gian nào không mất phí vận chuyển tự sx nên giá tối ưu đến tay người mua</p><p>- Tự sx nên đảm bảo chất lượng</p><p>-----------------------------------------------------------</p><p>Giày nam 2020 mới nhất, siêu chất lượng Này là một trong những sản phẩm siêu cấp nhất tại shop</p><p>- Sản phẩm có chất liệu đẹp, bền và nhẹ đi rất êm và ôm chân!</p><p>- Size nam 39 đến 44</p></ul></body></html><p>Giá sản phẩm trên Tiki đã bao gồm thuế theo luật hiện hành. Bên cạnh đó, tuỳ vào loại sản phẩm, hình thức và địa chỉ giao hàng mà có thể phát sinh thêm chi phí khác như phí vận chuyển, phụ phí hàng cồng kềnh, thuế nhập khẩu (đối với đơn hàng giao từ nước ngoài có giá trị trên 1 triệu đồng).....</p><p>Sản phẩm này là tài sản cá nhân được bán bởi Nhà Bán Hàng Cá Nhân và không thuộc đối tượng phải chịu thuế GTGT. Do đó hoá đơn VAT không được cung cấp trong trường hợp này.</p>","https://salt.tikicdn.com/ts/product/bc/d5/25/893dd8d17cd8602173e2c5496e436ad2.jpg,https://salt.tikicdn.com/ts/product/2a/ed/a2/2474af69bfff1c749de7926fbfa09b74.jpg,https://salt.tikicdn.com/ts/product/b7/82/aa/380e1e0dcbf3d2c22b1ac3628600dcde.jpg,https://salt.tikicdn.com/ts/product/06/fc/a1/091879bdce0b178f0a60c8f05ed6531e.jpg,https://salt.tikicdn.com/ts/product/55/aa/ba/426dcab4ff486e1501f951f7be822ac7.jpg,https://salt.tikicdn.com/ts/product/ae/a8/ee/b1224d470bcf8013e040d3390af7c333.jpg,https://salt.tikicdn.com/ts/product/19/95/11/d997c880695a626952c389772bd93067.jpg,https://salt.tikicdn.com/ts/product/08/46/f8/2e090fe77ffda728be13b9a3109a98c6.jpg,https://salt.tikicdn.com/ts/product/e3/21/29/ff5f47ac4bd619d0865bb42c6379c6be.jpg",OEM,Root
2580419436312,Giày bảo hộ Dragon 2B - Mũi thép đế thép chống trượt rất tốt,329400,"<html><head></head><body><ul><p>Đặc trưng:</p><p>- Cấu tạo là da, đem đến cho giày bảo hộ lao động dragon 2B độ bền chắc theo thời gian.</p><p>- Với các đường chỉ may chắc chắn, cố định chắc phần da và phần đế cao su.</p><p>- Giày da bảo hộ với phần đế bằng cao su, dày và chắc chắn, bảo vệ đôi chân tuyệt đối khỏi các vật thể đâm xuyên.</p><p>- Có giảm sóc giúp bàn chân đỡ mỏi.</p></ul></body></html><p>Giá sản phẩm trên Tiki đã bao gồm thuế theo luật hiện hành. Bên cạnh đó, tuỳ vào loại sản phẩm, hình thức và địa chỉ giao hàng mà có thể phát sinh thêm chi phí khác như phí vận chuyển, phụ phí hàng cồng kềnh, thuế nhập khẩu (đối với đơn hàng giao từ nước ngoài có giá trị trên 1 triệu đồng).....</p>","https://salt.tikicdn.com/ts/product/c2/48/de/614bf3d60924c25a452f42106696d2e0.jpg,https://salt.tikicdn.com/ts/product/e8/b3/74/cffba8ae9f231447fee02bd82ab7fe8b.jpg,https://salt.tikicdn.com/ts/product/07/b8/e4/9c92311e207d515525662ea0f3f28eb9.jpg,https://salt.tikicdn.com/ts/product/3f/5b/71/6186e3afb264c181cd73a6fa2515a80c.jpg,https://salt.tikicdn.com/ts/product/6d/71/a9/356b548652d1f97cbc06b1419094abe3.jpg",OEM,Root
7112553031288,Giày Sneaker Nam Thanh Lịch Họa Tiết Cá Heo,140000,"<p><img id=""https://salt.tikicdn.com/ts/tmp/f7/4d/19/22cfa8ca334d9a274cad0fcb26062a99.png"" title="""" src=""https://salt.tikicdn.com/ts/tmp/f7/4d/19/22cfa8ca334d9a274cad0fcb26062a99.png"" alt="""" width=""750"" height=""776""></p><p><img id=""https://salt.tikicdn.com/ts/tmp/e8/77/62/1957e1d19abf22533c6d6d1a97cda427.png"" title="""" src=""https://salt.tikicdn.com/ts/tmp/e8/77/62/1957e1d19abf22533c6d6d1a97cda427.png"" alt="""" width=""750"" height=""547""></p><p><img id=""https://salt.tikicdn.com/ts/tmp/00/b1/6a/956bf3b6ad076a8d3ba33ac3dff4124a.png"" title="""" src=""https://salt.tikicdn.com/ts/tmp/00/b1/6a/956bf3b6ad076a8d3ba33ac3dff4124a.png"" alt="""" width=""750"" height=""504""></p><p><img id=""https://salt.tikicdn.com/ts/tmp/23/fe/0e/4f0cf82f0a23995f91cfbc335c01daec.png"" title="""" src=""https://salt.tikicdn.com/ts/tmp/23/fe/0e/4f0cf82f0a23995f91cfbc335c01daec.png"" alt="""" width=""750"" height=""543""></p><p><img id=""https://salt.tikicdn.com/ts/tmp/91/e7/06/56062304c5cb44cc5b0b68b51a560a3e.png"" title="""" src=""https://salt.tikicdn.com/ts/tmp/91/e7/06/56062304c5cb44cc5b0b68b51a560a3e.png"" alt="""" width=""750"" height=""512""></p><p><img id=""https://salt.tikicdn.com/ts/tmp/b0/25/f6/36226bc0749fa0a3afac502f9564af37.png"" title="""" src=""https://salt.tikicdn.com/ts/tmp/b0/25/f6/36226bc0749fa0a3afac502f9564af37.png"" alt="""" width=""750"" height=""458""></p><p><img id=""https://salt.tikicdn.com/ts/tmp/48/e9/49/ac98c3bc627dfd15e114287005de4fbb.png"" title="""" src=""https://salt.tikicdn.com/ts/tmp/48/e9/49/ac98c3bc627dfd15e114287005de4fbb.png"" alt="""" width=""750"" height=""539""></p><p> </p><p>Giá sản phẩm trên Tiki đã bao gồm thuế theo luật hiện hành. Bên cạnh đó, tuỳ vào loại sản phẩm, hình thức và địa chỉ giao hàng mà có thể phát sinh thêm chi phí khác như phí vận chuyển, phụ phí hàng cồng kềnh, thuế nhập khẩu (đối với đơn hàng giao từ nước ngoài có giá trị trên 1 triệu đồng).....</p>",https://salt.tikicdn.com/ts/product/62/58/a2/5b2ebe1c3c6c56b6976d8ab94a660bed.png,OEM,Thời Trang
7231814699866,Giày đinh vải đá bóng nam Thượng Đình (trắng),115000,"<h2 style=""color:#2f2f2f;font-family:Arial,Helvetica,sans-serif"">Giày đinh vải đá bóng nam Thượng Đình (đen)</h2><p style=""color:#2f2f2f;font-family:Arial,Helvetica,sans-serif;font-size:12px"">Giày đinh vải đá bóng nam Thượng Đình (đen) là loại giày làm bằng chất liệu vải có kiểu dáng thể thao,bền, đẹp, nhẹ. Giúp công việc di chuyển nhẹ nhàng, linh hoạt, dễ chịu hơn cho đôi chân, không tạo cảm giác khó chịu.</p><h3 style=""color:#2f2f2f;font-family:Arial,Helvetica,sans-serif"">Một số đặc điểm nổi bật</h3><ul style=""color:#2f2f2f;font-family:Arial,Helvetica,sans-serif;font-size:12px""><li>Nhà sản xuất : Thượng Đình</li><li>Chất liệu: vải thô</li><li>Màu sắc: màu đen</li><li>Đế giày: Đinh nhựa chống trơn trượt,đế khâu</li><li>Thân giầy làm từ lớp lót bông</li><li>Thích hợp chơi đá bóng (sân đất hay sân cỏ thật),đi bộ,...và có thể tham gia các hoạt động ngoài trời</li><li>Sản phẩm được sản xuất theo HTQLCL &amp; MT đạt tiêu chuẩn: ISO 9001:2000 - ISO 14001:2004.</li><li>Sản phẩm được công nhận là hàng Việt Nam chất lượng cao.</li></ul><hr style=""color:#2f2f2f;font-family:Arial,Helvetica,sans-serif;font-size:12px""><h3 style=""text-align:center"">Chất liệu</h3><p style=""text-align:center"">Vải thô, bền đẹp</p><p style=""color:#2f2f2f;font-family:Arial,Helvetica,sans-serif;font-size:12px""><img style=""display:block;margin-left:auto;margin-right:auto;max-width:100%"" src=""https://vcdn.tikicdn.com/ts/tmp/00/c1/95/6d4dd0538753bd7c9af81d0e6fdc3f52.jpg"" alt=""Giày đinh vải đá bóng nam Thượng Đình (trắng)"" width=""720"" height=""480""></p><hr style=""color:#2f2f2f;font-family:Arial,Helvetica,sans-serif;font-size:12px""><h3 style=""text-align:center"">Màu sắc tinh tế, phù hợp mọi lứa tuổi</h3><p style=""color:#2f2f2f;font-family:Arial,Helvetica,sans-serif;font-size:12px""><img style=""display:block;margin-left:auto;margin-right:auto;max-width:100%"" src=""https://vcdn.tikicdn.com/ts/tmp/f2/51/ea/b1ffe60955ae46188c304d733b06f3c2.jpg"" alt=""Giày đinh vải đá bóng nam Thượng Đình (trắng)"" width=""720"" height=""405""></p><hr style=""color:#2f2f2f;font-family:Arial,Helvetica,sans-serif;font-size:12px""><h3 style=""text-align:center"">Đế giày</h3><p style=""text-align:center"">Đinh nhựa chống trơn trượt,đế khâu</p><p style=""color:#2f2f2f;font-family:Arial,Helvetica,sans-serif;font-size:12px""><img style=""display:block;margin-left:auto;margin-right:auto;max-width:100%"" src=""https://vcdn.tikicdn.com/ts/tmp/da/1d/67/d41640bd24d144988ef10d269339effd.jpg"" alt=""Giày đinh vải đá bóng nam Thượng Đình (trắng)"" width=""405"" height=""720""></p><hr style=""color:#2f2f2f;font-family:Arial,Helvetica,sans-serif;font-size:12px""><h3 style=""text-align:center"">Thích hợp chơi đá bóng (sân đất hay sân cỏ thật),đi bộ,...và có thể tham gia các hoạt động ngoài trời</h3><p style=""color:#2f2f2f;font-family:Arial,Helvetica,sans-serif;font-size:12px""><img style=""display:block;margin-left:auto;margin-right:auto;max-width:100%"" src=""https://vcdn.tikicdn.com/ts/tmp/37/a0/48/8df952303a852d3a61db3a2afa3332cf.jpg"" alt=""Giày đinh vải đá bóng nam Thượng Đình (trắng)"" width=""480"" height=""720""></p><hr style=""color:#2f2f2f;font-family:Arial,Helvetica,sans-serif;font-size:12px""><h3 style=""text-align:center"">Bảng chọn size chân cho phù hợp</h3><p style=""color:#2f2f2f;font-family:Arial,Helvetica,sans-serif;font-size:12px""><img style=""display:block;margin-left:auto;margin-right:auto;max-width:100%"" src=""http://www.tuyetnhungsports.com.vn/media/wysiwyg/giaytd/kenshoes.vn-bang-do-size-giay-nam_grande.jpg"" alt=""Kính bơi Speedo abc""></p><hr style=""color:#2f2f2f;font-family:Arial,Helvetica,sans-serif;font-size:12px""><table id=""thongtinthuonghieu2"" class=""mceItemTable"" style=""width:100%""><tbody><tr><td style=""width:30%;border-right:1px;border-right-style:solid""><h2 style=""text-align:center""><span style=""font-size:medium"">Thông tin thương hiệu</span></h2><p><img style=""display:block;margin-left:auto;margin-right:auto"" src=""http://www.tuyetnhungsports.com.vn/media/wysiwyg/giaythuongdinh/Logo.jpg"" alt=""""></p></td><td style=""padding-left:1%""><p>Công ty Giầy Thượng Đình được thành lập từ năm 1957. Chuyên sản xuất giầy vải, giầy thể thao và dép các loại. Công ty đã được đảng, nhà nước, chính phủ ghi nhận và tặng thưởng nhiều danh hiệu cao quí như: Huân chương lao động hạng nhất, hạng nhì, hạng ba; Huân chương chiến công hạng ba, Huân chương độc lập hạng nhì, Huân chương độc lập hạng ba... Từ năm 1998 đến nay, công ty đã áp dụng thành công HTQLCL ISO 9001:2000. Cùng với trên 2000 CBCNV và 7 dây chuyền sản xuất hiện đại, dàn thêu vi tính, trung tâm thiết kế mẫu 3D, phòng thí nghiệm phân tính năng cơ lý của sản phẩm, đến năm 2005 công ty đã đầu tư mở rộng sản xuất thêm một nhà máy mới chuyên sản xuất giầy da và giầy thể thao xuất khẩu tại khu công nghiệp Đồng Văn thuộc tỉnh Hà Nam nâng năng lực sản xuất của công ty đạt tới 5,5 triệu đôi/năm trong đó 2,5 triệu đôi là giầy xuất khẩu và 3 triệu đôi tiêu thụ trong nước. Thị trường xuất khẩu chính của công ty là các nước thành viên khối EU (chiếm 80% sản lượng giầy xuất khẩu), ngoài ra còn xuất sang các nước khác như Mêxico, Mỹ, Úc, Nhật và một số nước trong khu vực Đông Nam Á. Bên cạnh thị trường xuất khẩu công ty luôn giữ vững thị phần tại thị trường nội địa, sản phẩm của công ty đã có mặt trên khắp các tỉnh thành trên cả nước phục vụ các nhu cầu: luyện tập thể thao, leo núi, picnic, bảo hộ lao động và các loại giầy thời trang... liên tục nhiều năm liền, sản phẩm giầy vải Thượng Đình được chứng nhận vào TOPTEN hàng tiêu dùng Việt Nam, hàng Việt Nam chất lượng cao, đạt giải vàng chất lượng. Nhãn hiệu giầy Thượng Đình được công nhận nhãn hiệu nổi tiếng quốc gia. Thương hiệu Thượng Đình đạt thương hiệu mạnh, thương hiệu nổi tiếng tại Việt Nam..</p></td></tr></tbody></table><p>Giá sản phẩm trên Tiki đã bao gồm thuế theo luật hiện hành. Bên cạnh đó, tuỳ vào loại sản phẩm, hình thức và địa chỉ giao hàng mà có thể phát sinh thêm chi phí khác như phí vận chuyển, phụ phí hàng cồng kềnh, thuế nhập khẩu (đối với đơn hàng giao từ nước ngoài có giá trị trên 1 triệu đồng).....</p>","https://salt.tikicdn.com/ts/product/03/4d/ca/fb880006a166ef920654b2709f65fa9f.jpg,https://salt.tikicdn.com/ts/product/00/55/75/cf4b13f25a44e4624c66030d145b9780.jpg,https://salt.tikicdn.com/ts/product/1d/52/29/a8fa7ec5984a3bec9b643fce43cd476b.jpg,https://salt.tikicdn.com/ts/product/27/47/1f/f570d7640e79b5f53e1cc558c9d22b3b.jpg",Thượng Đình,Giày đá banh nam
1357102687695,Giày Thể Thao Nam Sneaker Thoáng Khí Năng Động Trẻ Trung Cổ Vừa Màu Đen GNA04 SUNO STORE,175000,"<html><head></head><body><ul><p>Giày Thể Thao Nam Sneaker Thoáng Khí Năng Động Trẻ Trung Cổ Vừa Màu Đen GNA04 SUNO STORE</p><p>_GIÀY THỂ THAO NAM SNEAKER NĂNG ĐỘNG VÀ CÁ TÍNH</p><p>+Màu sắc: màu đen</p><p>+Chất liệu: bề mặt lưới dày thoáng khí+đế cao sư êm chân</p><p>+Size: 40.41.42.43.44</p><p>_giày sneaker nam là sản phẩm không thể thiếu đối với phái nam,đặc biệt khi thời tiết lạnh lại cần hơn bao giờ hết để bảo vệ đôi chân vì vậy mà sản phẩm giày thể thao nam sneaker đáp ứng đủ tiêu chí như đế giày cao su êm chân,bề mặt giày nam vải lưới dày dặn có thể dùng 4 màu xuân hạ thu đôày sneaker nam được thiết kế thêm phần phản quang phát sáng khi trời tối têm nét độc đáo và trẻ trung hơn.</p><p>_giày thể thao nam đa năng có thể dùng đi làm,đi chơi ,chạy bộ tập thể thao ,tập gym đều rất tiện lợi</p><p>_thiết kế màu sắc đen cho đôi giày nam thêm phần sang trọng và dễ dàng phối đồ .</p><p>_HƯỚNG DẪN BẢO QUẢN GIÀY THỂ THAO NAM</p><p>+Không để giày ở nơi ẩm ướt</p><p>+Không nên giặt giày sneaker nam bằng dung dịch tẩy rửa mạnh</p></ul></body></html><p>Giá sản phẩm trên Tiki đã bao gồm thuế theo luật hiện hành. Bên cạnh đó, tuỳ vào loại sản phẩm, hình thức và địa chỉ giao hàng mà có thể phát sinh thêm chi phí khác như phí vận chuyển, phụ phí hàng cồng kềnh, thuế nhập khẩu (đối với đơn hàng giao từ nước ngoài có giá trị trên 1 triệu đồng).....</p><p>Sản phẩm này là tài sản cá nhân được bán bởi Nhà Bán Hàng Cá Nhân và không thuộc đối tượng phải chịu thuế GTGT. Do đó hoá đơn VAT không được cung cấp trong trường hợp này.</p>","https://salt.tikicdn.com/ts/product/66/1b/b9/b1c3edde7781ba4ecb999e7846f2a6f2.jpg,https://salt.tikicdn.com/ts/product/c5/e1/bb/b26295467aa2514de63b0e15295a06ae.jpg,https://salt.tikicdn.com/ts/product/0c/04/98/41e5fa95ab744aad5efb6f9a54351791.jpg,https://salt.tikicdn.com/ts/product/86/7b/1d/68c75feccb0bb1bcc53462bbf6604bf3.jpg,https://salt.tikicdn.com/ts/product/5f/16/5c/16020f52bd58a7a4ffec438ea569d5d0.jpg,https://salt.tikicdn.com/ts/product/99/36/61/7461f2ac251aed4809ac075e3df0035d.jpg,https://salt.tikicdn.com/ts/product/9c/a8/88/c80be3c4a1a64075492ed2bb77116930.jpg,https://salt.tikicdn.com/ts/product/b0/b8/96/1c223e2ec75244a998a184a0a45aefe5.jpg,https://salt.tikicdn.com/ts/product/32/b5/63/9346854b6afe6c15611272e4957d264c.jpg",OEM,Root
