SKU,Name,Price,Description,Image URLs,Brand Name,Category
4360925087470,Giày sneaker thể thao nam X-Game Shoes Anta 112228065S,1199000,"<p><em><strong>Giày sneaker thể thao nam X-Game Shoes Anta 812128061</strong></em><br>- Đế chống trơn trượt, kết hợp cùng kiểu dáng thể thao và màu sắc nổi bật, chắc chắn sẽ là phụ kiện được nhiều bạn lựa chọn để thể hiện phong cách thể thao khỏe khoắn, năng động.<br>- Bên cạnh đó, chất liệu nhẹ, êm ái giúp bạn luôn cảm thấy thoải mái trong suốt quá trình vận động.<br>- Chất liệu: 100% da tổng hợp<br>- Xuất xứ: Trung Quốc</p><p>Anta được thành lập bởi Ding Shi Zhong vào năm 1994, hoạt động chủ yếu là thiết kế, phát triển, sáng tạo và tiêu thụ các loại sản phẩm thể dục thể thao. Thương Anta bao gồm giày dép thể thao, quần áo thể thao và phụ kiện. Với slogan ""Keep M"" thể hiện sự vận động, phấn đấu không ngừng và phát triển đi lên, Anta được vinh danh là “Thương nổi tiếng Trung Quốc”, “Nhãn nổi bật Trung Quốc”, và là “Sản phẩm miễn kiểm tra chất lượng”</p><p><img id=""https://salt.tikicdn.com/ts/tmp/1a/69/d1/eedae582b4b53c58805dca4cb76758f0.jpg"" title="""" src=""https://salt.tikicdn.com/ts/tmp/1a/69/d1/eedae582b4b53c58805dca4cb76758f0.jpg"" alt="""" width=""750"" height=""750""></p><p><img id=""https://salt.tikicdn.com/ts/tmp/8c/8d/88/4a66fab136084ae19a230be10b1d82c5.jpg"" title="""" src=""https://salt.tikicdn.com/ts/tmp/8c/8d/88/4a66fab136084ae19a230be10b1d82c5.jpg"" alt="""" width=""750"" height=""750""></p><p><img id=""https://salt.tikicdn.com/ts/tmp/fb/54/ac/8697043a0ad7b8fbbed8a43028c39cd3.jpg"" title="""" src=""https://salt.tikicdn.com/ts/tmp/fb/54/ac/8697043a0ad7b8fbbed8a43028c39cd3.jpg"" alt="""" width=""750"" height=""750""></p><p><img id=""https://salt.tikicdn.com/ts/tmp/8b/59/29/bcb6ba4da557d72d50aa9648cddc5c6d.jpg"" title="""" src=""https://salt.tikicdn.com/ts/tmp/8b/59/29/bcb6ba4da557d72d50aa9648cddc5c6d.jpg"" alt="""" width=""750"" height=""750""></p><p><img id=""https://salt.tikicdn.com/ts/tmp/2f/39/cc/0d3b3c1f90fc7f96b35ce9eb2aae6dc4.jpg"" title="""" src=""https://salt.tikicdn.com/ts/tmp/2f/39/cc/0d3b3c1f90fc7f96b35ce9eb2aae6dc4.jpg"" alt="""" width=""750"" height=""750""></p><p><img id=""https://salt.tikicdn.com/ts/tmp/17/bf/1d/306e95382d6d3b3de79b9953a504d839.jpg"" title="""" src=""https://salt.tikicdn.com/ts/tmp/17/bf/1d/306e95382d6d3b3de79b9953a504d839.jpg"" alt="""" width=""750"" height=""750""></p><p><img id=""https://salt.tikicdn.com/ts/tmp/2d/c8/b0/6bdb64fb4c7cfd22604fde1b39396d1b.jpg"" title="""" src=""https://salt.tikicdn.com/ts/tmp/2d/c8/b0/6bdb64fb4c7cfd22604fde1b39396d1b.jpg"" alt="""" width=""750"" height=""750""></p><p><img id=""https://salt.tikicdn.com/ts/tmp/3a/66/83/9242e4e640fa6d24bba6b9d6521c8ebb.jpg"" title="""" src=""https://salt.tikicdn.com/ts/tmp/3a/66/83/9242e4e640fa6d24bba6b9d6521c8ebb.jpg"" alt="""" width=""750"" height=""750""></p><p><img id=""https://salt.tikicdn.com/ts/tmp/b1/7e/43/3251db0830ef9775b5f606a557fd4c3d.jpg"" title="""" src=""https://salt.tikicdn.com/ts/tmp/b1/7e/43/3251db0830ef9775b5f606a557fd4c3d.jpg"" alt="""" width=""750"" height=""750""></p><p><img id=""https://salt.tikicdn.com/ts/tmp/3e/bd/59/25cb00e35fe664e8225df5d234fc781e.jpg"" title="""" src=""https://salt.tikicdn.com/ts/tmp/3e/bd/59/25cb00e35fe664e8225df5d234fc781e.jpg"" alt="""" width=""750"" height=""750""></p><p><img id=""https://salt.tikicdn.com/ts/tmp/92/e0/57/9e1283eee5acf8fcac57f2c86c838417.jpg"" title="""" src=""https://salt.tikicdn.com/ts/tmp/92/e0/57/9e1283eee5acf8fcac57f2c86c838417.jpg"" alt="""" width=""750"" height=""750""></p><p><img id=""https://salt.tikicdn.com/ts/tmp/82/0d/bf/03be51941b01ecbc9dc197a161bc5b3a.jpg"" title="""" src=""https://salt.tikicdn.com/ts/tmp/82/0d/bf/03be51941b01ecbc9dc197a161bc5b3a.jpg"" alt="""" width=""750"" height=""750""></p><p><img src=""https://salt.tikicdn.com/ts/tmp/79/5a/57/59846204fc4837ddd8991c19c8bdd7d2.jpg"" alt="""" width=""750"" height=""750""></p><p>Giá sản phẩm trên Tiki đã bao gồm thuế theo luật hiện hành. Bên cạnh đó, tuỳ vào loại sản phẩm, hình thức và địa chỉ giao hàng mà có thể phát sinh thêm chi phí khác như phí vận chuyển, phụ phí hàng cồng kềnh, thuế nhập khẩu (đối với đơn hàng giao từ nước ngoài có giá trị trên 1 triệu đồng).....</p>","https://salt.tikicdn.com/ts/product/0e/a4/4c/768960025b4ee5aed23a6a504442a715.jpg,https://salt.tikicdn.com/ts/product/45/7b/8d/a5784de7d7e9103876967e6004d7557e.jpg,https://salt.tikicdn.com/ts/product/e5/4e/67/2e5a6d010014302b5b953f658677c28c.jpg,https://salt.tikicdn.com/ts/product/ef/9e/8b/20f0fd97d29b63da53a4a2d158a031c1.jpg,https://salt.tikicdn.com/ts/product/50/e8/a5/7b3b034f320429db08d733cf7dbcc1ff.jpg,https://salt.tikicdn.com/ts/product/1a/69/d1/b6a23eaffa686303d9b26fbf731f0a3e.jpg,https://salt.tikicdn.com/ts/product/0c/e9/20/a79f9503ebde91456a5f2608f641e463.jpg,https://salt.tikicdn.com/ts/product/fb/54/ac/1a4ff62ca8b9e19e9eb122b9bb7c6796.jpg,https://salt.tikicdn.com/ts/product/8b/59/29/51e6a62b9e066773d9ba6f6909b63f5b.jpg,https://salt.tikicdn.com/ts/product/75/94/c9/461e2713b09aee1258e2313ed9ae1cfe.jpg,https://salt.tikicdn.com/ts/product/79/5a/57/0465db2a4f9f40d6b7bb09e92e5a05d9.jpg",ANTA,Thể Thao - Dã Ngoại
5251493431973,Giày thể thao nam - nữ phong cách dễ thương – GNU1018,900000,"<p>1.Thiết kế: có form giày dễ thương, năng động, phối màu bắt mắt</p><p>2.Chất liệu: phần trên của đôi giày được làm từ chất liệu da cao cấp, mềm mại, giúp cho người mang giày có cảm giác dễ chịu. Thêm vào đó là phần đế giày được làm từ cao su đúc với độ bền cao giúp tăng độ ma sát cũng như sự chắc chắn cho đôi giày. Với thiết kế phối màu dễ thương, có thể kết hợp được với nhiều trang phục khác nhau để tạo cho bé 1 set đồ đẹp khi đi chơi</p><ol><li>Size: 35-40</li></ol><p>4.Hướng dẫn bảo quản giày</p><p>- Nếu bạn thường thuyên đi giày nên vệ sinh 1-2 lần/1 tuần.</p><p>- Không nên giặt bằng máy giặt vì sẽ làm cho đôi giày trở nên biến dạng mất form giày.</p><p>- Tránh ngâm trong nước quá lâu.</p><p>- Không sử dụng chất tẩy rửa.</p><p>- Tránh tiếp xúc với các chất gây loang màu.</p><p>- Nên để giày trong kệ riêng giúp bảo quản giày tốt và bền hơn.</p><p><img title="""" src=""https://salt.tikicdn.com/ts/tmp/f0/78/89/8cce99592089b010cc6af3c3fa520fa1.jpg"" alt="""" width=""750"" height=""750""></p><p><img title="""" src=""https://salt.tikicdn.com/ts/tmp/86/7e/7b/e745a87bc329dc5c9c94b85d83315105.jpg"" alt="""" width=""750"" height=""750""></p><p><img title="""" src=""https://salt.tikicdn.com/ts/tmp/cb/d6/76/6034d25c5a384461282670e9bffde5d6.jpg"" alt="""" width=""750"" height=""750""></p><p><img title="""" src=""https://salt.tikicdn.com/ts/tmp/27/e1/5c/451536d1aeac3940c7f6421154e55c69.jpg"" alt="""" width=""750"" height=""750""></p><p><img title="""" src=""https://salt.tikicdn.com/ts/tmp/c7/f0/98/3bccc9b8dd7e46fcd3124f8119dccbd4.jpg"" alt="""" width=""750"" height=""750""></p><p><img title="""" src=""https://salt.tikicdn.com/ts/tmp/cf/e1/66/dad78654769934edfb01fff83f305fa0.jpg"" alt="""" width=""750"" height=""750""></p><p><img title="""" src=""https://salt.tikicdn.com/ts/tmp/08/48/f8/03415f87f58337705f00b9660548f87f.jpg"" alt="""" width=""750"" height=""750""></p><p><img title="""" src=""https://salt.tikicdn.com/ts/tmp/c1/b3/0f/0ed3fefab3f37d6ff366198fb29ef354.jpg"" alt="""" width=""750"" height=""750""></p><p><img title="""" src=""https://salt.tikicdn.com/ts/tmp/36/5e/1b/8f1f701e9b37f6362bbe6e865bb3bf14.jpg"" alt="""" width=""750"" height=""750""></p><p>Giá sản phẩm trên Tiki đã bao gồm thuế theo luật hiện hành. Bên cạnh đó, tuỳ vào loại sản phẩm, hình thức và địa chỉ giao hàng mà có thể phát sinh thêm chi phí khác như phí vận chuyển, phụ phí hàng cồng kềnh, thuế nhập khẩu (đối với đơn hàng giao từ nước ngoài có giá trị trên 1 triệu đồng).....</p>","https://salt.tikicdn.com/ts/product/f0/78/89/b0dfae197d813f8e6402423f45b38309.jpg,https://salt.tikicdn.com/ts/product/86/7e/7b/8007f511da9a600a9a81144bd9035e36.jpg,https://salt.tikicdn.com/ts/product/cb/d6/76/b97bae96441994600d7f377894548afb.jpg,https://salt.tikicdn.com/ts/product/27/e1/5c/28c4eeb653b36dccea9ce68438b913d1.jpg,https://salt.tikicdn.com/ts/product/c7/f0/98/06b28c3b8f74044966886e3556953486.jpg,https://salt.tikicdn.com/ts/product/cf/e1/66/cf65c685a5d8b45c9233694ac5504d98.jpg,https://salt.tikicdn.com/ts/product/08/48/f8/8dba19b46185a6583d9d2649e7864391.jpg,https://salt.tikicdn.com/ts/product/c1/b3/0f/a211f71cc7dd3545510c2de0a75c8c0f.jpg,https://salt.tikicdn.com/ts/product/36/5e/1b/5c42ac5ba99ec9d67142364989edad0b.jpg",Bee Gee,Giày thể thao nam cổ thấp
8978503637945,Giày thể thao nam / nữ phong cách mới – G1004A,840000,"<p>Giày thể thao nam/ nữ thời trang, giày chạy bộ nam ôm chân thoáng khí</p><p>Giày được thiết kế đẹp mắt, có tính thẩm mỹ cao</p><p>Thiết kế da cao cấp mềm, thoáng khí</p><p>Mũi giày ôm theo dáng bàn chân, không gây khó chịu trong lúc di chuyển</p><p>Đế giày nhân bản mềm mại , chất liệu  tự nhiên, được thiết kế để tăng độ ma sát chống trơn trượt.</p><p>Size: 36,37,38,39,40,41,42,43,44      </p><p><img title="""" src=""https://salt.tikicdn.com/ts/tmp/db/61/40/342137314cb1f6c22a306b2d8aa2e68e.jpg"" alt="""" width=""750"" height=""750""></p><p><img title="""" src=""https://salt.tikicdn.com/ts/tmp/ec/a4/b5/86ed36f13480874980047fbcd058e37f.jpg"" alt="""" width=""750"" height=""750""></p><p><img title="""" src=""https://salt.tikicdn.com/ts/tmp/f9/1b/ed/5a08bea9c3f5ea70e68163b56075a20d.jpg"" alt="""" width=""750"" height=""750""></p><p><img title="""" src=""https://salt.tikicdn.com/ts/tmp/dc/89/69/63c342758ff62d2af9e7a32eaee2f5f4.jpg"" alt="""" width=""750"" height=""900""></p><p><img title="""" src=""https://salt.tikicdn.com/ts/tmp/45/72/d9/4b1eecba136e5cd818f2013e7c2117a7.jpg"" alt="""" width=""750"" height=""750""></p><p><img title="""" src=""https://salt.tikicdn.com/ts/tmp/e0/18/b7/ab3ca85dacb48f49a5b1a76bc043f4a9.jpg"" alt="""" width=""750"" height=""750""></p><p><img title="""" src=""https://salt.tikicdn.com/ts/tmp/af/54/fa/2be614724c1f3722ce377582f1386714.jpg"" alt="""" width=""750"" height=""750""></p><p><img title="""" src=""https://salt.tikicdn.com/ts/tmp/77/9c/20/88bc7d61414ecaea8523850dbcd00931.jpg"" alt="""" width=""750"" height=""750""></p><p>Giá sản phẩm trên Tiki đã bao gồm thuế theo luật hiện hành. Bên cạnh đó, tuỳ vào loại sản phẩm, hình thức và địa chỉ giao hàng mà có thể phát sinh thêm chi phí khác như phí vận chuyển, phụ phí hàng cồng kềnh, thuế nhập khẩu (đối với đơn hàng giao từ nước ngoài có giá trị trên 1 triệu đồng).....</p>","https://salt.tikicdn.com/ts/product/db/61/40/887f8624781c04b0bd976bedd2409d81.jpg,https://salt.tikicdn.com/ts/product/ec/a4/b5/9b4a5ddf2a245cd15c986200578307a5.jpg,https://salt.tikicdn.com/ts/product/f9/1b/ed/ba568175301fda36d70910c729730b55.jpg,https://salt.tikicdn.com/ts/product/dc/89/69/21788cdbe74d0d0e152cb3776695a091.jpg,https://salt.tikicdn.com/ts/product/45/72/d9/379de023b3ec67dca1dcb387bae76623.jpg,https://salt.tikicdn.com/ts/product/e0/18/b7/9a5b3dee721d3d15b19f187bb5eff484.jpg,https://salt.tikicdn.com/ts/product/af/54/fa/f99d5d84b9d9e758cf324b4b5780b5b2.jpg,https://salt.tikicdn.com/ts/product/77/9c/20/7425640263f6f4c8c0604a90bfe253ac.jpg",Bee Gee,Giày - Dép nam
7995410973691,+ FULL BOX + ViDeo thật Giày Thể Thao Nam - Phong Cách Cực Ngầu - Mới nhất,478400,"<html><head></head><body><ul><p>[FULL BOX - 2022] Giày Thể Thao Nam - Phong Cách Cực Ngầu Thời Trang Trẻ Trung</p><p>CHÀO MỪNG BẠN GHÉ THĂM SHOP</p><p>️ Các chương trình khuyến mại bất ngờ cực kỳ hấp dẫn sẽ có tại Shop mời bạn ấn theo dõi để biết thêm chi tiết</p><p>️ FRRESHIP / HỖ TRỢ PHÍ VẬN CHUYỂN ( KHÁCH KO BIẾT ÁP MÃ VẬN CHUYỂN CHAT / INBOX SHOP TRƯỚC KHI ĐẶT HÀNG ĐỂ ĐC HƯỚNG DẪN )</p><p>THÔNG TIN SẢN PHẨM GIÀY THỂ THAO NAM</p><p>️ Chất liệu: Da PU cao cấp mềm mại, kết hợp vải sợi thoáng khí bền đẹp theo thời gian</p><p>️ Đế giày được làm bằng chất liệu cao su đúc nguyên khối chắc chắn có khắc họa tiết để tăng độ ma sát, chống trơn trượt.</p><p>️ Màu sắc: Xanh - Trắng - Cam</p><p>️ Size: 39-44</p><p>ĐẶC ĐIỂM SẢN PHẨM GIÀY THỂ THAO NAM</p><p>️ Giày dễ phối đồ thích hợp cho các hoạt động đi lại hàng ngày, chạy bộ</p><p>️ Mũi Giày tròn, đế cao su tổng hợp, xẻ rãnh tạo cảm giác thoải mái khi đi</p><p>️ Thích hợp với các mùa trong năm: Xuân - Hè - Thu - Đông</p><p>HƯỚNG DẪN BẢO QUẢN GIAY THỂ THAO NAM</p><p>️ Để giày ở nơi khô ráo thoáng mát để giữ giày được bền đẹp hơn</p><p>️ Vệ sinh giày, dùng khăn hay bàn trải lông mềm để chải sạch giày cùng với nước tẩy rửa giày chuyên dụng với da hay da Pu</p><p>️ Có thể giặt giày cùng với chất tẩy rửa nhẹ</p><p>KHUYẾN CÁO</p><p>Không dùng hóa chất hay bột giặt có hoạt tính tẩy rửa mạnh</p><p>Không dùng bàn chải cứng để vệ sinh giày sẽ làm hư</p><p>Không đi mưa ngâm nước lâu, không phơi giày trực tiếp dưới ngoài trời nắng gắt</p><p>Shop cam kết:</p><p>Sản phẩm chuẩn 100% như hình</p><p>Giao hàng trên toàn quốc</p><p>----------------------------------------------------------------------------------------------------------------------------------------</p><p>LỜI MUỐN NÓI! Nhận giày xong mong các bạn sẽ có những phản hồi tích cực như Feedback hình ảnh hoặc đánh giá 5 sao nếu cảm thấy OK. Mọi vấn đề bạn chưa vừa lòng xin hãy inbox để được hỗ trợ trước khi đánh giá nhé. Cảm ơn bạn đã đặt giày. Đừng quên nhấn theo dõi nha!</p></ul></body></html><p>Giá sản phẩm trên Tiki đã bao gồm thuế theo luật hiện hành. Bên cạnh đó, tuỳ vào loại sản phẩm, hình thức và địa chỉ giao hàng mà có thể phát sinh thêm chi phí khác như phí vận chuyển, phụ phí hàng cồng kềnh, thuế nhập khẩu (đối với đơn hàng giao từ nước ngoài có giá trị trên 1 triệu đồng).....</p><p>Sản phẩm này là tài sản cá nhân được bán bởi Nhà Bán Hàng Cá Nhân và không thuộc đối tượng phải chịu thuế GTGT. Do đó hoá đơn VAT không được cung cấp trong trường hợp này.</p>","https://salt.tikicdn.com/ts/product/38/5a/b1/444b31563868e99f5c2e319e5889f1fe.jpg,https://salt.tikicdn.com/ts/product/ed/d7/d8/5833daec76b439a803f07f1132c69172.jpg,https://salt.tikicdn.com/ts/product/38/5a/b1/b86596241ddb17904adceaf2b2489ac3.jpg,https://salt.tikicdn.com/ts/product/3a/bc/c6/f906430c5fc5c60efbe1f65098c17023.jpg,https://salt.tikicdn.com/ts/product/0e/f8/4d/7d13d05d3596f0025cf07d3594cb1681.jpg,https://salt.tikicdn.com/ts/product/55/a6/b3/4d7722aceddceecbcf9ef9f430d82175.jpg,https://salt.tikicdn.com/ts/product/58/7b/d2/b8c05cd4821279acd018ec569ac9d0a5.jpg,https://salt.tikicdn.com/ts/product/ec/fa/00/45e3bfebe581cbb02c7d6e2c0e5b639c.jpg,https://salt.tikicdn.com/ts/product/80/3c/fe/311d8aa5e59b187068de62cba758d55b.jpg,https://salt.tikicdn.com/ts/product/04/69/aa/a4c91eb84eeed2a51483078b656e871d.jpg",OEM,Root
6808198476405,"Giày Nam Cao Cổ, Giày Sneaker Thể Thao Nam Phong Cách Hàn Quốc - 8876",99000,"<html><head></head><body><ul><p>Giày sneaker thể thao nam chất da PU cao cấp, giày lên chân êm ái, nhẹ nhàng. Giày nhập trực tiếp từ Quảng Châu chất đẹp, chuẩn hình chuẩn size.</p><p>- Chất chất da PU cao cấp</p><p>- Lên chân nhẹ nhàng, êm ái</p><p>- Kiểu dáng thời trang mới nhất</p><p>- Hàng nhập Quảng Châu chuẩn hình, chất đẹp</p><p>Lý do chọn Solomon Shoes Shop</p><p>- Hỗ trợ phí vận chuyển lên tới tối đa 40K (cho đơn hàng từ 200K trở lên).</p><p>- 100% hàng nhập Quảng Châu chất lượng cao.</p><p>- Dẫn đầu về phong cách thời trang, đa dạng về mẫu mã, phù hợp cho mọi đối tượng khách hàng.</p><p>- Kiểu dáng và màu sắc lên hình chuẩn 100% so với thực tế.</p><p>- Giá cả cạnh tranh nhất.</p><p>- Giao hàng nhanh, hỗ trợ nhiệt tình, luôn lắng nghe ý kiến khách hàng.</p></ul></body></html><p>Giá sản phẩm trên Tiki đã bao gồm thuế theo luật hiện hành. Bên cạnh đó, tuỳ vào loại sản phẩm, hình thức và địa chỉ giao hàng mà có thể phát sinh thêm chi phí khác như phí vận chuyển, phụ phí hàng cồng kềnh, thuế nhập khẩu (đối với đơn hàng giao từ nước ngoài có giá trị trên 1 triệu đồng).....</p><p>Sản phẩm này là tài sản cá nhân được bán bởi Nhà Bán Hàng Cá Nhân và không thuộc đối tượng phải chịu thuế GTGT. Do đó hoá đơn VAT không được cung cấp trong trường hợp này.</p>","https://salt.tikicdn.com/ts/product/de/51/87/2559d1ea63a105095cbd2f2206b8aa8c.jpg,https://salt.tikicdn.com/ts/product/6e/19/e9/748657b8969869ade56fc8a30feecd68.jpg,https://salt.tikicdn.com/ts/product/c7/65/0e/074dd720c3ac02201d88246a51921ad3.jpg,https://salt.tikicdn.com/ts/product/f8/cd/bc/63b58e0a7a36559a71a614e2fdd6fa63.jpg,https://salt.tikicdn.com/ts/product/f6/87/0a/d2a9ebcf0b097dbbe8cf1cbe98e732c5.jpg,https://salt.tikicdn.com/ts/product/35/ec/95/80403a60f041ab51b8edb083722cd557.jpg,https://salt.tikicdn.com/ts/product/05/3a/db/738e5e57f5d3f1f026e1e60ec4083574.jpg",OEM,Root
9328891360098,Giày Thượng Đình KK14-1 White,105000,"<ul><li><strong>Giày Thượng Đình KK14-1 White</strong>  là loại giày làm bằng chất liệu vải có kiểu dáng thể thao, bền, đẹp, nhẹ. Giúp công việc di chuyển nhẹ nhàng, linh hoạt, dễ chịu hơn cho đôi chân, không tạo cảm giác khó chịu.</li><li>Đế giày được làm bằng cao su kếp tạo cảm giác êm ái cho người sử dụng. Đặc biệt với thiết kế mũi da giúp bảo vệ ngón chân khỏi tổn thương khi vận động mạnh.</li><li>Sản phẩm thích hợp dùng trong các hoạt động thể thao như đá bóng, cầu lông, chạy,…</li></ul><p><strong>Hướng dẫn chọn size:</strong> </p><table style=""width:488px;margin-left:auto;margin-right:auto"" border=""1""><tbody><tr><td style=""text-align:center;width:87px""><strong>UK</strong></td><td style=""text-align:center;width:89px""><strong>USA</strong></td><td style=""text-align:center;width:96.5px""><strong>EURO</strong></td><td style=""text-align:center;width:194.5px""><strong>Centimet foot (cm)</strong></td></tr><tr><td style=""width:87px;text-align:center"">3.5</td><td style=""width:89px;text-align:center"">4</td><td style=""width:96.5px;text-align:center"">36</td><td style=""width:194.5px;text-align:center"">22</td></tr><tr><td style=""width:87px;text-align:center"">4</td><td style=""width:89px;text-align:center"">4.5</td><td style=""width:96.5px;text-align:center"">37</td><td style=""width:194.5px;text-align:center"">22.5</td></tr><tr><td style=""width:87px;text-align:center"">4.5</td><td style=""width:89px;text-align:center"">5</td><td style=""width:96.5px;text-align:center"">37.5</td><td style=""width:194.5px;text-align:center"">23</td></tr><tr><td style=""width:87px;text-align:center"">5</td><td style=""width:89px;text-align:center"">5.5</td><td style=""width:96.5px;text-align:center"">38</td><td style=""width:194.5px;text-align:center"">23.5</td></tr><tr><td style=""width:87px;text-align:center"">5.5</td><td style=""width:89px;text-align:center"">6</td><td style=""width:96.5px;text-align:center"">38.5</td><td style=""width:194.5px;text-align:center"">24</td></tr><tr><td style=""width:87px;text-align:center"">6</td><td style=""width:89px;text-align:center"">6.5</td><td style=""width:96.5px;text-align:center"">39.5</td><td style=""width:194.5px;text-align:center"">24.5</td></tr><tr><td style=""width:87px;text-align:center"">6.5</td><td style=""width:89px;text-align:center"">7</td><td style=""width:96.5px;text-align:center"">40</td><td style=""width:194.5px;text-align:center"">25</td></tr><tr><td style=""width:87px;text-align:center"">7</td><td style=""width:89px;text-align:center"">7.5</td><td style=""width:96.5px;text-align:center"">40.5</td><td style=""width:194.5px;text-align:center"">25.5</td></tr><tr><td style=""width:87px;text-align:center"">7.5</td><td style=""width:89px;text-align:center"">8</td><td style=""width:96.5px;text-align:center"">41.5</td><td style=""width:194.5px;text-align:center"">26</td></tr><tr><td style=""width:87px;text-align:center"">8</td><td style=""width:89px;text-align:center"">8.5</td><td style=""width:96.5px;text-align:center"">42</td><td style=""width:194.5px;text-align:center"">26.5</td></tr><tr><td style=""width:87px;text-align:center"">8.5</td><td style=""width:89px;text-align:center"">9</td><td style=""width:96.5px;text-align:center"">42.5</td><td style=""width:194.5px;text-align:center"">27</td></tr><tr><td style=""width:87px;text-align:center"">9</td><td style=""width:89px;text-align:center"">9.5</td><td style=""width:96.5px;text-align:center"">43</td><td style=""width:194.5px;text-align:center"">27.5</td></tr><tr><td style=""width:87px;text-align:center"">9.5</td><td style=""width:89px;text-align:center"">10</td><td style=""width:96.5px;text-align:center"">44</td><td style=""width:194.5px;text-align:center"">28</td></tr><tr><td style=""width:87px;text-align:center"">10</td><td style=""width:89px;text-align:center"">10.5</td><td style=""width:96.5px;text-align:center"">44.5</td><td style=""width:194.5px;text-align:center"">28.5</td></tr><tr><td style=""width:87px;text-align:center"">10.5</td><td style=""width:89px;text-align:center"">11</td><td style=""width:96.5px;text-align:center"">45</td><td style=""width:194.5px;text-align:center"">29</td></tr><tr><td style=""width:87px;text-align:center"">11</td><td style=""width:89px;text-align:center"">11.5</td><td style=""width:96.5px;text-align:center"">45.5</td><td style=""width:194.5px;text-align:center"">29.5</td></tr></tbody></table><p> </p><p>Giá sản phẩm trên Tiki đã bao gồm thuế theo luật hiện hành. Bên cạnh đó, tuỳ vào loại sản phẩm, hình thức và địa chỉ giao hàng mà có thể phát sinh thêm chi phí khác như phí vận chuyển, phụ phí hàng cồng kềnh, thuế nhập khẩu (đối với đơn hàng giao từ nước ngoài có giá trị trên 1 triệu đồng).....</p>","https://salt.tikicdn.com/ts/product/6f/cf/12/f783691bd74ac32e270f259de93ac491.jpg,https://salt.tikicdn.com/ts/product/bf/5a/8a/a5668e1b68232fe1626abd7aa4ca5261.jpg,https://salt.tikicdn.com/ts/product/fb/5a/b7/a1d0b1852214b53b986896bc6f1c958d.jpg,https://salt.tikicdn.com/ts/product/ff/81/4c/12b6bea16d5e77530283b9622ab4553e.jpg",Thượng Đình,Giày thể thao nam khác
